<?xml version="1.0" encoding="UTF-8"?>
<!DOCTYPE matricula SYSTEM "matricula.dtd">
<matricula>
    <personal>
        <dni>12345678X</dni>
        <nombre>Angel Lerma</nombre>
        <titulacion>Ingeniería Informática</titulacion>
        <curso_academico>2025-2026</curso_academico>
        <domicilios>
            <domicilio tipo="habitual">Calle Universidad 12, Hermosillo</domicilio>
            <domicilio tipo="familiar">Av. Tecnológico 45, Hermosillo</domicilio>
        </domicilios>
    </personal>
    <pago>
        <tipo_matricula>Ordinaria</tipo_matricula>
    </pago>
</matricula>